Categoria;Grupo de Despesa;Pessoal;DESPESA AUTORIZADA;DESPESA EXECUTADA
DESPESA CORRENTE;Administração de pessoal;GERAL + UPAS;R$ 0,00;R$ 0,00
DESPESA CORRENTE;Aquisição de material de consumo  Geral + UPAS;Material de consumo Geral + UPAS;R$ 0,00;R$ 0,00
DESPESA CORRENTE;Contratação de serviços de terceiros Geral + UPAS;Serviços de terceiros Geral + UPAS;R$ 0,00;R$ 0,00
DESPESA CORRENTE;Manutenção de serviços administrativos  Geral+UPAS;Despesas Gerais Geral +UPAS;R$ 0,00;R$ 0,00
DESPESA CORRENTE;Manutenção de serviços administrativos Geral + UPAS;Concessionárias Geral + UPAS;R$ 0,00;R$ 0,00